{
  "DataList":[
    {
    "id":1,
    "brand":"Casio",
    "imageUrl":"https://www.jomashop.com/casio-watch-gw9400-1.html",
    "watchName":"G-Shock Rangeman Multi-Band 6 Atomic Timekeeping Digital Dial",
    "gender":"Men",
    "watchColor":"Black",
    "description":"Black resin case with a black resin strap. Fixed black resin bezel. Digital dial displaying: hours, minutes, seconds, date and day of the week. Dial Type: Analog. Luminescent auto led. Quartz movement. Scratch resistant mineral crystal. Solid case back. Case size: 53 mm. Case thickness: 18 mm. Round case shape. Tang clasp. Water resistant at 200 meters / 660 feet. Functions: date, day, hour, minute, second, solar powered. Additional Info: igital compass, altimeter, barometer, thermometer, sunrise and sunset date, time stamp, mb6 atomic timekeeping, suitable for recreational scuba diving. Casual watch style. Item Variations: GW9400 1, GW9400.1, GW94001. Casio G-Shock Rangeman Multi-Band 6 Atomic Timekeeping Digital Dial Men's Watch GW9400-1.",
    "price":209,
    "techType":"Digital",
    "type":"Watch",
    "material":"Resin"
    },
    {
      "id":2,
      "brand":"Casio",
      "imageUrl":"https://www.jomashop.com/casio-g-shock-world-time-chronograph-quartz-analog-digital-watch-ga700sk-1.html",
      "watchName":"G-Shock World Time Chronograph Quartz Analog-Digital Watch",
      "gender":"Men",
      "watchColor":"Black",
      "description":"Transparent resin case and strap. Fixed black resin bezel with a transparent resin ring. Silver dial with luminous black hands and index hour markers. Minute markers around the outer rim. Dial Type: Analog-digital. Luminescent hands. Complete calendar. Function sub-dial. Digital display showing: date and day of the week. Casio calibre 5522 quartz movement. Scratch resistant mineral crystal. Solid case back. Round case shape. Case dimensions: 57.5 mm x 53.4 mm. Case thickness: 18.1 mm. Tang clasp. Water resistant at 200 meters / 660 feet. Functions: full calendar, chronograph, world time, alarm, month, date, day, GMT, second time zone, hour, minute, second, shock resistant. G-shock Series. Sport watch style. Watch label: Japan Movt. Casio G-Shock World Time Chronograph Quartz Analog-Digital Watch GA700SK-1.",
      "price":74,
      "techType":"Analog-digital",
      "type":"Watch",
      "material":"Resin"
    },
    {
      "id":3,
      "brand":"Casio",
      "imageUrl":"https://www.jomashop.com/casio-g-shock-mens-watch-ga100-1a1.html",
      "watchName":"G-Shock Perpetual Alarm World Time Chronograph Quartz Analog-Digital",
      "gender":"Men",
      "watchColor":"Black",
      "description":"Black resin case and strap. Fixed black bezel. Black dial with silver-tone hands and index hour markers. Minute markers around the outer rim. Dial Type: Analog-digital. Luminescent hands and markers. Perpetual calendar. One subdial displaying: small second. Casio Calibre 5081 quartz movement. Scratch resistant mineral crystal. Solid case back. Round case shape, case size: 55 × 51.2 mm, case thickness: 16.9 mm. Band width: 20 mm, band length: Men's standard. Tang clasp. Water resistant at 200 meters / 660 feet. Functions: perpetual calendar, chronograph, world time, alarm, month, date, day, GMT, hour, minute, second, shock resistant. G-shock Series. Sport watch style. Watch label: Japan Movt. Casio G-Shock Perpetual Alarm World Time Chronograph Quartz Analog-Digital Black Dial Men's Watch GA-100-1A1.",
      "price":70,
      "techType":"Analog-digital",
      "type":"Watch",
      "material":"Resin"
    },
    {
      "id":4,
      "brand":"Casio",
      "imageUrl":"https://www.jomashop.com/casio-g-shock-chronograph-analog-digital-black-dial-mudmaster-mens-watch-ggb100-1a9.html",
      "watchName":"G-Shock Chronograph Analog-Digital Black Dial Mudmaster",
      "gender":"Men",
      "watchColor":"Black",
      "description":"Black resin case and strap. Fixed black bezel. Black dial with silver-tone hands and index hour markers. Minute markers around the outer rim. Dial Type: Analog-digital. Luminescent hands and markers. Perpetual calendar. One subdial displaying: small second. Casio Calibre 5081 quartz movement. Scratch resistant mineral crystal. Solid case back. Round case shape, case size: 55 × 51.2 mm, case thickness: 16.9 mm. Band width: 20 mm, band length: Men's standard. Tang clasp. Water resistant at 200 meters / 660 feet. Functions: perpetual calendar, chronograph, world time, alarm, month, date, day, GMT, hour, minute, second, shock resistant. G-shock Series. Sport watch style. Watch label: Japan Movt. Casio G-Shock Perpetual Alarm World Time Chronograph Quartz Analog-Digital Black Dial Men's Watch GA-100-1A1.",
      "price":264,
      "techType":"Analog-digital",
      "type":"Watch",
      "material":"Resin"

    },
    {
      "id":5,
      "brand":"Casio",
      "imageUrl":"https://www.jomashop.com/casio-g-shock-perpetual-alarm-world-time-chronograph-quartz-analog-digital-ladies-watch-gma-s120sr-7a.html",
      "watchName":"G-Shock Perpetual Alarm World Time Chronograph Quartz Analog-Digital",
      "gender":"Ladies",
      "watchColor":"White",
      "description":"Transparent resin case and strap. Fixed transparent resin bezel. Rose gold dial with rose gold-tone hands and index hour markers. Dial Type: Analog-digital. Perpetual calendar. Chronograph - sub-dials displaying: digital. Casio Calibre 5518 quartz movement. Scratch resistant mineral crystal. Solid case back. Round case shape, case size: 49 mm x 45.9 mm, case thickness: 15.8 mm. Tang clasp. Water resistant at 200 meters / 660 feet. Functions: perpetual calendar, chronograph, world time, alarm, month, date, day, GMT, second time zone, hour, minute, second, shock resistant, magnetic resistant. G-shock Series. Sport watch style. Watch label: Japan Movt. Casio G-Shock Perpetual Alarm World Time Chronograph Quartz Analog-Digital Ladies Watch GMA-S120SR-7A.",
      "price":89,
      "techType":"Analog-digital",
      "type":"Watch",
      "material":"Resin"
    },
    {
      "id":6,
      "brand":"Casio",
      "imageUrl":"https://www.jomashop.com/casio-g-shock-perpetual-alarm-world-time-chronograph-quartz-analog-digital-ladies-watch-gma-s120sr-7a.html",
      "watchName":"G-Shock Digital Dial Pink Resin",
      "gender":"Ladies",
      "watchColor":"White",
      "description":"Transparent resin case and strap. Fixed transparent resin bezel. Rose gold dial with rose gold-tone hands and index hour markers. Dial Type: Analog-digital. Perpetual calendar. Chronograph - sub-dials displaying: digital. Casio Calibre 5518 quartz movement. Scratch resistant mineral crystal. Solid case back. Round case shape, case size: 49 mm x 45.9 mm, case thickness: 15.8 mm. Tang clasp. Water resistant at 200 meters / 660 feet. Functions: perpetual calendar, chronograph, world time, alarm, month, date, day, GMT, second time zone, hour, minute, second, shock resistant, magnetic resistant. G-shock Series. Sport watch style. Watch label: Japan Movt. Casio G-Shock Perpetual Alarm World Time Chronograph Quartz Analog-Digital Ladies Watch GMA-S120SR-7A.",
      "price":89,
      "techType":"Analog-digital",
      "type":"Watch",
      "material":"Resin"
    },
    {
      "id":7,
      "brand":"Casio",
      "imageUrl":"https://www.jomashop.com/casio-watch-ba110-7a1.html",
      "watchName":"Baby G White Resin Ladies Watch",
      "gender":"Ladies",
      "watchColor":"White",
      "description":"Transparent resin case and strap. Fixed transparent resin bezel. Rose gold dial with rose gold-tone hands and index hour markers. Dial Type: Analog-digital. Perpetual calendar. Chronograph - sub-dials displaying: digital. Casio Calibre 5518 quartz movement. Scratch resistant mineral crystal. Solid case back. Round case shape, case size: 49 mm x 45.9 mm, case thickness: 15.8 mm. Tang clasp. Water resistant at 200 meters / 660 feet. Functions: perpetual calendar, chronograph, world time, alarm, month, date, day, GMT, second time zone, hour, minute, second, shock resistant, magnetic resistant. G-shock Series. Sport watch style. Watch label: Japan Movt. Casio G-Shock Perpetual Alarm World Time Chronograph Quartz Analog-Digital Ladies Watch GMA-S120SR-7A.",
      "price":80,
      "techType":"Analog-digital",
      "type":"Watch",
      "material":"Resin"

    },
    {
    "id":8,
    "brand":"Casio",
    "imageUrl":"https://www.jomashop.com/casio-baby-g-watch-bgd-560cr-2.html",
    "watchName":"Baby G Quartz Digital Dial Ladies Watch",
    "gender":"Ladies",
    "watchColor":"Mint Green",
    "description":"Mint green resin case and strap. Fixed mint green resin bezel. Digital dial displaying: hours, minutes, seconds, am/pm, date and day of the week. Luminescent electro luminescent backlight. Quartz movement. Scratch resistant mineral crystal. Pull / push crown. Solid case back. Rectangle case shape. Case size: 40 mm. Case thickness: 12.5 mm. Band width: 24 mm. Tang clasp. Water resistant at 200 meters / 660 feet. Functions: date, day, hour, minute, second. Additional Info: world time. 1/100 second stopwatch, countdown timer, alarms, hourly time signal, full auto calendar. Baby G Series. Casual watch style. Casio Baby G Quartz Digital Dial Ladies Watch BGD-560CR-2.",
    "price":80,
    "techType":"Digital",
    "type":"Watch",
    "material":"Resin"
  },
  {
    "id":9,
    "brand":"Casio",
    "imageUrl":"https://www.jomashop.com/casio-perpetual-alarm-world-time-chronograph-quartz-digital-watch-gd120cm-5.html",
    "watchName":"Perpetual Alarm World Time Chronograph Quartz Digital Watch",
    "gender":"Unisex",
    "watchColor":"Brown and green",
    "description":"Brown and green camouflage resin case and strap. Fixed brown and green camouflage resin bezel. Digital dial. Dial Type: digital. Luminescent led backlight (super illuminator). Perpetual calendar. Casio Calibre 3427 quartz movement. Scratch resistant mineral crystal. Solid case back. Round case shape, case size: 55 mm x 51.2 mm. Buckle clasp. Water resistant at 200 meters / 660 feet. Functions: perpetual calendar, chronograph, world time, alarm, month, date, day, GMT, second time zone, hour, minute, second, shock resistant. Sport watch style. Watch label: Japan Movt. Casio Perpetual Alarm World Time Chronograph Quartz Digital Watch GD120CM-5.",
    "price":100,
    "techType":"Digital",
    "type":"Watch",
    "material":"Resin"
  },
  {
    "id":10,
    "brand":"Casio",
    "imageUrl":"https://www.jomashop.com/casio-g-shock-pink-dial-ladies-watch-gmas110np-8a.html",
    "watchName":"G-Shock Quartz Analog-Digital Pink Dial",
    "gender":"Ladies",
    "watchColor":"Black",
    "description":"Black resin case with a grey resin strap. Fixed black resin bezel. Pink dial with pink hands and index hour markers. Minute markers. Dial Type: Analog-digital. Digital sub-dials. Quartz movement. Scratch resistant mineral crystal. Pull / push crown. Solid case back. Round case shape. Case size: 50 mm. Case thickness: 15 mm. Band width: 29 mm. Band length: 7.5 inches. Tang clasp. Water resistant at 200 meters / 660 feet. Functions: date, day, hour, minute, second. G-shock Series. Sport watch style. Casio G-Shock Quartz Analog-Digital Pink Dial Ladies Watch GMAS110NP-8A.",
    "price":136,
    "techType":"Analog-digital",
    "type":"Watch",
    "material":"Resin"
  },
  {
    "id":11,
    "brand":"Casio",
    "imageUrl":"https://www.jomashop.com/casio-g-shock-alarm-world-time-quartz-analog-digital-black-dial-mens-watch-ga-900-1a.html",
    "watchName":"G-Shock Alarm World Time Quartz",
    "gender":"Men",
    "watchColor":"Black",
    "description":"Black resin case and strap. Fixed resin bezel. Black dial with black hands and index hour markers. Minute markers around the outer rim. Dial Type: Analog-digital. Luminescent super led light. Full auto-calendar (to year 2099). Quartz movement. Scratch resistant mineral crystal. Solid case back. Round case shape, case size: 52.8 mm x 49.5 mm, case thickness: 16.9 mm. Tang clasp. Water resistant at 200 meters / 660 feet. Functions: hour, minute, second, pm, month, date, day, shock resistant, world time, 29 time zones (48 cities + coordinated universal time), daylight saving on/off, 5 daily alarms (with 1 snooze alarm), 12/24-hour format. G-shock Series. Sport watch style. Casio G-Shock Alarm World Time Quartz Analog-Digital Black Dial Men's Watch GA-900-1A.",
    "price":75,
    "techType":"Analog-digital",
    "type":"Watch",
    "material":"Resin"
  },
  {
    "id":12,
    "brand":"Casio",
    "imageUrl":"https://www.jomashop.com/casio-watch-ga100l-8a.html",
    "watchName":"G-Shock Black Dial Men's Sand Beige Sports Watch",
    "gender":"Men",
    "watchColor":"Sand Beige",
    "description":"Sand beige resin case with a sand beige resin bracelet. Fixed sand beige resin bezel. Black dial with silver-tone hands and index hour markers. Dial Type: Analog-digital. Luminescent hands and markers. Day and date display at the 4 o'clock position. Quartz movement. Scratch resistant mineral crystal. Solid case back. Case size: 55 mm x 51.2 mm. Case thickness: 16.9 mm. Round case shape. Tang clasp. Water resistant at 200 meters / 660 feet. Functions: date, day, month, hour, minute, second, world time, 1/1000-second stopwatch, countdown timer, 5 daily alarms (with 1 snooze alarm), 12/24-hour format. Sport watch style. Casio G-Shock Black Dial Men's Sand Beige Sports Watch GA100L-8A.",
    "price":75,
    "techType":"Analog-digital",
    "type":"Watch",
    "material":"Resin"
  },
  {
    "id":13,
    "brand":"Casio",
    "imageUrl":"https://www.jomashop.com/casio-sheen-chronograph-quartz-ladies-watch-shn-5016d-7adr.html",
    "watchName":"Sheen Chronograph Quartz Ladies Watch",
    "gender":"Ladies",
    "watchColor":"Siliver",
    "description":"Silver-tone stainless steel case and bracelet. Fixed tachymeter scale rose gold-tone stainless steel bezel. Mother of pearl dial with rose gold-tone hands and index hour markers. Minute markers around the outer rim. Dial Type: Analog. Luminescent hands and markers. Date display at the 3 o'clock position. Chronograph - three sub-dials displaying: 60 second, 60 minute and 24 hour. Quartz movement. Solid case back. Round case shape, case size: 40 mm. Deployment with push button release clasp. Water resistant at 50 meters / 165 feet. Functions: chronograph, date, hour, minute, second. Sheen Series. Casual watch style. Watch label: Japan Movt. Item Variations: SHN 5016D 7ADR, SHN.5016D.7ADR, SHN5016D7ADR. Casio Sheen Chronograph Quartz Ladies Watch SHN-5016D-7ADR.",
    "price":90,
    "techType":"Analog",
    "type":"Watch",
    "material":"Stainless Steel"
  },
  {
    "id":14,
    "brand":"Citizen",
    "imageUrl":"https://www.jomashop.com/citizen-watch-at8020-54l.html",
    "watchName":"Eco Drive Blue Angels Chronograph Men's Watch",
    "gender":"Men",
    "watchColor":"Siliver",
    "description":"Stainless steel case with a stainless steel bracelet. Fixed blue ion-plated bezel. Blue dial with luminous hands and index hour markers. Minute markers. World time cities. Navigation calculator markings around the outer rim. Dial Type: Analog. Luminescent hands and markers. Date display at the 3 o'clock position. Three sub-dials displaying: 60 second, 24 hour and dual 1/100th of a second/day of the week. Eco-Drive H800 Atomic Timekeeping Radio Controlled eco-drive movement. Scratch resistant sapphire crystal. Pull / push crown. Solid case back. Round case shape. Case size: 43 mm. Case thickness: 12 mm. Band width: 22 mm. Band length: 8.5 inches. Fold over clasp with a double push button release. Water resistant at 200 meters / 660 feet. Functions: chronograph, date, hour, minute, second, perpetual calendar, world time. Blue Angels Series. Sport watch style. Watch label: Japan Movt. Item Variations: AT8020 54L, AT8020.54L, AT802054L. Citizen Eco Drive Blue Angels Chronograph Men's Watch AT8020-54L.",
    "price":359,
    "techType":"Analog",
    "type":"Watch",
    "material":"Stainless Steel"
  },
  {
    "id":15,
    "brand":"Citizen",
    "imageUrl":"https://www.jomashop.com/citizen-promaster-green-dial-mens-watch-bn0157-11x.html",
    "watchName":"Promaster Green Dial Men's Watch",
    "gender":"Men",
    "watchColor":"Green",
    "description":"Silver-tone stainless steel case with a green rubber strap. Uni-directional rotating silver-tone stainless steel bezel with an inlaid green ring. Green dial with black hands and index hour markers. Minute markers around the outer rim. Dial Type: Analog. Luminescent hands and markers. Date display at the 4 o'clock position. Citizen Caliber Eco-Drive E168 eco-drive movement. Scratch resistant mineral crystal. Screw down crown. Solid case back. Round case shape, case size: 44 mm, case thickness: 11.5 mm. Tang clasp. Water resistant at 200 meters / 660 feet. Functions: date, hour, minute, second, solar-powered. Promaster Series. Sport watch style. Watch label: Japan Movt. Citizen Promaster Green Dial Men's Watch BN0157-11X.",
    "price":195,
    "techType":"Analog",
    "type":"Watch",
    "material":"Stainless Steel"
  },
  {
    "id":16,
    "brand":"Citizen",
    "imageUrl":"https://www.jomashop.com/citizen-watch-bn0151-09l.html",
    "watchName":"Promaster Professional Diver 200 Meters Eco-Drive Men's Watch",
    "gender":"Men",
    "watchColor":"Blue",
    "description":"Stainless steel case with a navy blue polyurethane strap. Uni-directional rotating stainless steel bezel with a blue ion-plated ring. Dark blue dial with luminous silver-tone and orange hands and dot hour markers. Minute markers around the outer rim. Dial Type: Analog. Luminescent hands and markers. Date display at the 4 o'clock position. Citizen caliber Eco-Drive E168 eco-drive movement. Scratch resistant mineral crystal. Screw down crown. Solid case back. Round case shape. Case size: 44 mm. Case thickness: 12 mm. Band width: 20 mm. Band length: 7.5 inches. Tang clasp. Water resistant at 200 meters / 660 feet. Functions: date, hour, minute, second. Additional Info: solar power watch. charges with light, never requires battery or battery replacement. ",
    "price":204,
    "techType":"Analog",
    "type":"Watch",
    "material":"Stainless Steel"
  },
  {
    "id":17,
    "brand":"Citizen",
    "imageUrl":"https://www.jomashop.com/citizen-promaster-diver-watch-bn0200-56e.html",
    "watchName":"Promaster Diver Luminous Eco-Drive Men's Watch",
    "gender":"Men",
    "watchColor":"Siliver",
    "description":"Super titanium case and bracelet. Uni-directional rotating titanium bezel with a black aluminium ring. Black dial with silver-tone hands and index hour markers. Minute markers around the outer rim. Dial Type: Analog. Luminescent hands and markers. Date display at the 3 o'clock position. Citizen caliber Eco-Drive E168 eco-drive movement. Scratch resistant mineral crystal. Screw down crown. Solid case back. Round case shape. Case size: 44 mm. Case thickness: 12 mm. Band width: 22 mm. Safety fold over clasp with a push button release. Water resistant at 200 meters / 660 feet. Functions: date, hour, minute, second, solar-powered. Sport watch style. Watch label: Japan Movt. Citizen Promaster Diver Luminous Eco-Drive Men's Watch BN0200-56E. ",
    "price":289,
    "techType":"Analog",
    "type":"Watch",
    "material":"Super Titanium"
  },
  {
    "id":18,
    "brand":"Citizen",
    "imageUrl":"https://www.jomashop.com/citizen-eco-drive-blue-dial-elegant-ladies-watch-em0500-73l.html",
    "watchName":"Eco-Drive Blue Dial Elegant Ladies Watch",
    "gender":"Ladies",
    "watchColor":"Siliver",
    "description":"Stainless steel case with a stainless steel bracelet. Fixed stainless steel bezel. Blue dial with silver-tone hands and index hour markers. Roman numeral appear at the 6 and 12 o'clock positions. Dial Type: Analog. Citizen caliber Eco-Drive E031 eco-drive movement. Scratch resistant mineral crystal. Pull / push crown. Solid case back. Round case shape. Case size: 32 mm. Case thickness: 7 mm. Fold over clasp with a push button release. Water resistant at 50 meters / 165 feet. Functions: hour, minute, second. Casual watch style. Watch label: Japan Movt. Citizen Eco-Drive Blue Dial Elegant Ladies Watch EM0500-73L.",
    "price":110,
    "techType":"Analog",
    "type":"Watch",
    "material":"Stainless Steel"
  },
  {
    "id":19,
    "brand":"Citizen",
    "imageUrl":"https://www.jomashop.com/citizen-silhouette-crystal-eco-drive-silver-dial-ladies-watch-em0980-50a.html",
    "watchName":"Silhouette Crystal Eco-Drive Silver Dial Ladies Watch",
    "gender":"Ladies",
    "watchColor":"Siliver",
    "description":"Stainless steel case with a stainless steel bracelet. Fixed stainless steel bezel set with crystals. White dial with silver-tone hands. Roman numerals appear at the 6 and 12 o'clock positions. Dial Type: Analog. Citizen Caliber Eco-Drive E031 eco-drive movement. Scratch resistant mineral crystal. Pull / push crown. Solid case back. Octagonal case shape. Case size: 23 mm. Band width: 6 mm. Jewelry clasp. Water resistant at 50 meters / 165 feet. Functions: hour, minute, second, solar-powered. Silhouette Crystal Series. Dress watch style. Watch label: Japan Movt. Citizen Silhouette Crystal Eco-Drive Silver Dial Ladies Watch EM0980-50A.",
    "price":200,
    "techType":"Analog",
    "type":"Watch",
    "material":"Stainless Steel"
  },
  {
    "id":20,
    "brand":"Citizen",
    "imageUrl":"https://www.jomashop.com/citizen-mickey-mouse-crystal-silver-dial-ladies-watch-fe7044-52w.html",
    "watchName":"Mickey Mouse Eco-Drive Crystal Silver Dial Ladies Watch",
    "gender":"Ladies",
    "watchColor":"Siliver",
    "description":"stainless steel bracelet. Fixed yellow gold-tone bezel set with crystals. Silver (Mickey Mouse) dial with yellow gold-tone hands and Roman numeral hour markers. Dial Type: Analog. Citizen caliber J830 eco-drive movement. Scratch resistant mineral crystal. Pull / push crown. Solid case back. Round case shape. Case size: 36 mm. Case thickness: 9.6 mm. Band width: 14 mm. Deployment clasp. Water resistant at 50 meters / 165 feet. Functions: hour, minute, second. Mickey Mouse Series. Dress watch style. Citizen Mickey Mouse Eco-Drive Crystal Silver Dial Ladies Watch FE7044-52W.",
    "price":250,
    "techType":"Analog",
    "type":"Watch",
    "material":"Stainless Steel"
  },
  {
    "id":21,
    "brand":"Citizen",
    "imageUrl":"https://www.jomashop.com/citizen-eco-drive-octagon-diamond-black-dial-watch-bm7495-59g.html",
    "watchName":"Eco-Drive Octagon Diamond Black Dial Watch",
    "gender":"Unisex",
    "watchColor":"Black",
    "description":"Black ion-plated stainless steel case and bracelet. Fixed black ion-plated bezel. Black dial with grey hands and diamond hour markers. Dial Type: Analog. Date display at the 3 o'clock position. Citizen caliber Eco-Drive E111 eco-drive movement. Scratch resistant sapphire crystal. Pull / push crown. Solid case back. Octagon case shape. Case size: 41 mm. Case thickness: 9.6 mm. Band width: 22 mm. Deployment clasp. Water resistant at 100 meters / 330 feet. Functions: date, hour, minute, second, solar-powered. Eco-drive Series. Dress watch style. Watch label: Japan Movt. Citizen Eco-Drive Octagon Diamond Black Dial Watch BM7495-59G.",
    "price":299,
    "techType":"Analog",
    "type":"Watch",
    "material":"Stainless Steel"
  },
  {
    "id":22,
    "brand":"Citizen",
    "imageUrl":"https://www.jomashop.com/citizen-quartz-analog-digital-black-dial-watch-jy8085-14h.html",
    "watchName":"Quartz Analog-Digital Black Dial Watch",
    "gender":"Unisex",
    "watchColor":"Black",
    "description":"Black ion-plated stainless steel case and bracelet. Fixed black ion-plated bezel. Black dial with grey hands and diamond hour markers. Dial Type: Analog. Date display at the 3 o'clock position. Citizen caliber Eco-Drive E111 eco-drive movement. Scratch resistant sapphire crystal. Pull / push crown. Solid case back. Octagon case shape. Case size: 41 mm. Case thickness: 9.6 mm. Band width: 22 mm. Deployment clasp. Water resistant at 100 meters / 330 feet. Functions: date, hour, minute, second, solar-powered. Eco-drive Series. Dress watch style. Watch label: Japan Movt. Citizen Eco-Drive Octagon Diamond Black Dial Watch BM7495-59G.",
    "price":564,
    "techType":"Analog-digital",
    "type":"Watch",
    "material":"Stainless Steel"
  },
  {
    "id":23,
    "brand":"Citizen",
    "imageUrl":"https://www.jomashop.com/citizen-perpetual-world-time-watch-cb0241-85x.html",
    "watchName":"Perpetual World Time Watch",
    "gender":"Unisex",
    "watchColor":"Siliver",
    "description":"Stainless steel case with a silver-tone stainless steel bracelet. Fixed silver-tone stainless steel bezel. Burgundy dial with white hands and Arabic numeral/indexes hour markers. Dial Type: Analog. Luminescent hands and markers. Perpetual calendar. Date, signal reception indicator, summer time indicator subdials. Citizen Caliber Eco-Drive H145 eco-drive movement. Scratch resistant sapphire crystal. Solid case back. Round case shape, case size: 42.4 mm. Functions: perpetual calendar, atomic timekeeping, radio controlled, world time, date, GMT, second time zone, hour, minute, second, solar-powered. Watch label: Japan Movt. Citizen Perpetual World Time Watch CB0241-85X.",
    "price":435,
    "techType":"Analog",
    "type":"Watch",
    "material":"Stainless Steel"
  },
  {
    "id":24,
    "brand":"Citizen",
    "imageUrl":"https://www.jomashop.com/citizen-diamond-ladies-watch-em0880-54d.html",
    "watchName":"Diamond Mother of Pearl Dial ",
    "gender":"Ladies",
    "watchColor":"Siliver",
    "description":"Stainless steel case with a stainless steel bracelet. Fixed stainless steel bezel set with diamonds. Mother of pearl dial with silver-tone hands and Roman numeral hour markers. Minute markers around the outer rim. Dial Type: Analog. Citizen caliber E033 eco-drive movement. Scratch resistant sapphire crystal. Pull / push crown. Solid case back. Round case shape. Case size: 32 mm. Band width: 15 mm. Deployment clasp. Water resistant at 50 meters / 165 feet. Functions: hour, minute, second. Dress watch style. Watch label: Japan Movt. Citizen Diamond Mother of Pearl Dial Ladies Watch EM0880-54D.",
    "price":499,
    "techType":"Analog",
    "type":"Watch",
    "material":"Stainless Steel"
  },
  {
    "id":25,
    "brand":"Citizen",
    "imageUrl":"https://www.jomashop.com/citizen-eco-drive-chronograph-blue-dial-mens-watch-at1190-87l.html",
    "watchName":"Eco-Drive Chronograph Blue Dial",
    "gender":"Men",
    "watchColor":"Siliver",
    "description":"Silver-tone stainless steel case and bracelet. Fixed silver-tone stainless steel bezel. Blue dial with black hands and index hour markers. Minute markers around the outer rim. Dial Type: Analog. Date display at the 4 o'clock position. Chronograph - three sub-dials displaying: 60 second, 30 minute and 24 hour. Caliber H570 eco-drive movement with a 150-day power reserve. Scratch resistant mineral crystal. Solid case back. Round case shape, case size: 42 mm, case thickness: 11 mm. Band width: 22 mm. Fold over clasp with a safety release. Water resistant at 100 meters / 330 feet. Functions: chronograph, hour, minute, second. Sport watch style. Watch label: Japan Movt. Citizen Eco-Drive Chronograph Blue Dial Men's Watch AT1190-87L.",
    "price":195,
    "techType":"Analog",
    "type":"Watch",
    "material":"Stainless Steel"
  },
  {
    "id":26,
    "brand":"Citizen",
    "imageUrl":"https://www.jomashop.com/citizen-silhouette-crystal-eco-drive-silver-dial-ladies-watch-em0980-50a.html",
    "watchName":"Silhouette Crystal Eco-Drive Silver Dial Ladies Watch",
    "gender":"Ladies",
    "watchColor":"Siliver",
    "description":"Stainless steel case with a stainless steel bracelet. Fixed stainless steel bezel set with crystals. White dial with silver-tone hands. Roman numerals appear at the 6 and 12 o'clock positions. Dial Type: Analog. Citizen Caliber Eco-Drive E031 eco-drive movement. Scratch resistant mineral crystal. Pull / push crown. Solid case back. Octagonal case shape. Case size: 23 mm. Band width: 6 mm. Jewelry clasp. Water resistant at 50 meters / 165 feet. Functions: hour, minute, second, solar-powered. Silhouette Crystal Series. Dress watch style. Watch label: Japan Movt. Citizen Silhouette Crystal Eco-Drive Silver Dial Ladies Watch EM0980-50A.",
    "price":200,
    "techType":"Analog",
    "type":"Watch",
    "material":"Stainless Steel"
  },
  {
    "id":27,
    "brand":"Citizen",
    "imageUrl":"https://www.jomashop.com/citizen-black-panther-eco-drive-black-dial-mens-watch-aw1668-50w.html",
    "watchName":"Black Panther Eco-Drive Black Dial Men's Watch",
    "gender":"Men",
    "watchColor":"Siliver",
    "description":"Silver-tone titanium case and bracelet. Fixed silver-tone titanium bezel. Black dial with purple hands. Dial Type: Analog. Luminescent hands and markers. Date display at the 3 o'clock position. Citizen Caliber Eco-Drive J810 eco-drive movement. Scratch resistant sapphire crystal. Solid case back. Round case shape, case size: 41 mm. Band width: 13.8 mm. Fold over clasp with a safety release. Water resistant at 100 meters / 330 feet. Functions: date, hour, minute, second, solar-powered. Black Panther Series. Dress watch style. Watch label: Japan Movt. Citizen Black Panther Eco-Drive Black Dial Men's Watch AW1668-50W.",
    "price":335,
    "techType":"Analog",
    "type":"Watch",
    "material":"Stainless Steel"
  },
  {
    "id":28,
    "brand":"Citizen",
    "imageUrl":"https://www.jomashop.com/citizen-mickey-shadow-eco-drive-white-dial-unisex-watch-bv1130-03w.html",
    "watchName":"Mickey Shadow Eco-Drive White Dial Unisex Watch",
    "gender":"Unisex",
    "watchColor":"Black",
    "description":"Silver-tone stainless steel case with a black leather strap. Fixed silver-tone stainless steel bezel. White dial with black hands and index hour markers. Dial Type: Analog. Date display at the 3 o'clock position. Sub second hand subdials. Eco-drive movement. Scratch resistant mineral crystal. Pull / push crown. Solid case back. Round case shape, case size: 40 mm. Band width: 20 mm. Buckle clasp. Water resistant at 50 meters / 165 feet. Functions: date, hour, minute, sub second hand. Mickey Shadow Series. Casual watch style. Watch label: Japan Movt. Citizen Mickey Shadow Eco-Drive White Dial Unisex Watch BV1130-03W.",
    "price":166,
    "techType":"Analog",
    "type":"Watch",
    "material":"Stainless Steel"
  },
  {
    "id":29,
    "brand":"Titan",
    "imageUrl":"https://www.titan.co.in/product/titan-evoke-auto-stress-and-mood-monitoring-ai-voice-assistant-with-brown-colour-strap-90172al01",
    "watchName":"Titan Evoke",
    "gender":"Unisex",
    "watchColor":"Brown",
    "description":"Titan Evoke with large with 1.43inch AMOLED Display 1000 Nits Brightness, SingleSync, BT Calling, AI Voice Assistant, IP68 Water Resistance, Auto Stress and Mood Monitoring AI Voice Assistant with Black Colour Strap. Aluminium case with Mineral Glass. Round case shape. Case size: 47 mm, Case thickness: 12.3 mm  Water resistant at IP68.",
    "price":115,
    "techType":"Digital",
    "type":"Watch",
    "material":"Leather"
  },
  {
    "id":30,
    "brand":"Titan",
    "imageUrl":"https://www.titan.co.in/product/titan-talk-s-quartz-digital-smart-black-dial-watch-for-men-with-silicone-strap-90165ap01",
    "watchName":"Titan Talk S",
    "gender":"Men",
    "watchColor":"Black",
    "description":"Titan Talk S with 1.78inch AMOLED Display, Advanced BT Calling, 100+ Sports Modes, Stress & Mood Monitoring.",
    "price":109,
    "techType":"Digital",
    "type":"Watch",
    "material":"Silicone"
  },
  {
    "id":31,
    "brand":"Titan",
    "imageUrl":"https://www.titan.co.in/product/titan-raga-ceramics-green-dial-analog-watch-for-women-95146kd02",
    "watchName":"Titan Raga Ceramics Green Dial Metal Strap Watch",
    "gender":"Ladies",
    "watchColor":"Green",
    "description":"Metal case with Sapphire Crystal. Round case shape. Case size: 29 mm, Case thickness: 7.5 mm  Water resistant at 3 ATM.",
    "price":223,
    "techType":"Analog",
    "type":"Watch",
    "material":"Metal"
  },
  {
    "id":32,
    "brand":"Titan",
    "imageUrl":"https://www.titan.co.in/product/titan-anthracite-dial-analog-with-day-and-date-watch-for-men-1805km03",
    "watchName":"Black & Gold Anthracite Dial Stainless Steel Strap Watch",
    "gender":"Men",
    "watchColor":"Black",
    "description":"Black stainless steel case with Mineral Glass. Round case shape. Case size: 42 mm, Case thickness: 11.2 mm  Water resistant at 5 ATM.",
    "price":100,
    "techType":"Analog",
    "type":"Watch",
    "material":"Stainless Steel"
  },
  {
    "id":33,
    "brand":"Titan",
    "imageUrl":"https://www.titan.co.in/product/titan-love-all-brown-dial-analog-watches-for-women-95154qm01",
    "watchName":"Love All Brown Dial Brown Brass Strap Watch",
    "gender":"Ladies",
    "watchColor":"Brown",
    "description":"Brass case with Mineral Glass.Oval case shape. Case size: 20 mm, Case thickness: 6.9 mm  Water resistant at 3 ATM.",
    "price":134,
    "techType":"Analog",
    "type":"Watch",
    "material":"Brass"
  },
  {
    "id":34,
    "brand":"Titan",
    "imageUrl":"https://www.titan.co.in/product/titan-mechanical-blue-dial-stainless-steel-strap-watch-for-men-90110qm01",
    "watchName":"Mechanical Blue Dial Watch",
    "gender":"Men",
    "watchColor":"Blue",
    "description":"Blue stainless steel case with Mineral Glass Round case shape. Case size: 44 mm, Case thickness: 13.1 mm  Water resistant at 5 ATM.",
    "price":230,
    "techType":"Analog",
    "type":"Watch",
    "material":"Stainless Steel"
  },
  {
    "id":35,
    "brand":"Titan",
    "imageUrl":"https://www.titan.co.in/product/titan-animalia-prune-dial-analog-watch-for-women-95129qm01",
    "watchName":"Animalia",
    "gender":"Ladies",
    "watchColor":"Brown",
    "description":"Stainless steel, stone-studded case with Mineral Glass Round case shape. Case size: 42.6 mm, Case thickness: 7.9 mm, Strap Lug 14 mm,Water resistant at 5 ATM.",
    "price":149,
    "techType":"Analog",
    "type":"Watch",
    "material":"Stainless Steel"
  },
  {
    "id":36,
    "brand":"Titan",
    "imageUrl":"https://www.titan.co.in/product/titan-mother-of-pearl-dial-analog-watch-for-women-95032wm02j",
    "watchName":"Raga Moonlight Mother of Pearl Metal Strap Watch",
    "gender":"Ladies",
    "watchColor":"Rose Gold",
    "description":"This analog watch for women features a mother of pearl, round dial, enclosed within a brass case. The dial features plain two hands and white stone markings at the quarter intervals. The stone-studded, rose gold-coloured, stainless steel strap comes with a double pusher clasp. Equipped with 3 ATM water-resistant depth, the watch is user-friendly. It comes with a 24 month warranty.",
    "price":236,
    "techType":"Analog",
    "type":"Watch",
    "material":"Metal"
  },
  {
    "id":37,
    "brand":"Titan",
    "imageUrl":"https://www.titan.co.in/product/titan-maritime-watch-with-anthracite-dial-analog-with-day-and-date-function-for-men-1830qm01",
    "watchName":"Maritime Watch with Anthracite Dial",
    "gender":"Men",
    "watchColor":"Siliver",
    "description":"Stainless steel case with Mineral Glass, Analog with Day and Date. Round case shape. Case size: 43.5 mm, Case thickness: 12.45 mm, Strap Lug 14 mm,Water resistant at 5 ATM.",
    "price":216,
    "techType":"Analog-digital",
    "type":"Watch",
    "material":"Stainless Steel"
  },
  {
    "id":38,
    "brand":"Titan",
    "imageUrl":"https://www.titan.co.in/product/titan-edge-ceramic-blue-dial-analog-watch-for-men-1696qc03",
    "watchName":"Edge Ceramic - Slimmest Ceramic Analog Watch",
    "gender":"Men",
    "watchColor":"Blue",
    "description":"Ceramic case with Sapphire Crystal, Analog with Day and Date. Round case shape. Case size: 40.5 mm, Case thickness: 4.2 mm,Water resistant at 3 ATM.",
    "price":363,
    "techType":"Analog",
    "type":"Watch",
    "material":"Ceramic"
  },
  {
    "id":39,
    "brand":"Titan",
    "imageUrl":"https://www.titan.co.in/product/titan--edge-ceramic-quartz-analog-watch-with-white-colour-strap-for-men-1841qc03",
    "watchName":"Edge Squircle White Dial Ceramic Strap Watch",
    "gender":"Men",
    "watchColor":"White",
    "description":"Ceramic case with Sapphire Crystal. Rectangular case shape. Case size: 38 mm, Case thickness: 4.5 mm,Water resistant at 3 ATM",
    "price":484,
    "techType":"Analog",
    "type":"Watch",
    "material":"Ceramic"
  },
  {
    "id":40,
    "brand":"Titan",
    "imageUrl":"https://www.titan.co.in/product/titan-glitz-purple-dial-analog-watch-for-women-with-stainless-steel-strap-95207qd01",
    "watchName":"Glitz Purple Watch",
    "gender":"Ladies",
    "watchColor":"Purple",
    "description":"Stainless Steel and stone-studded case with Mineral Glass. Heptagon case shape. Metal & Plastic strap Case size: 29 mm, Case thickness: 7 mm,Water resistant at 3 ATM.",
    "price":150,
    "techType":"Analog",
    "type":"Watch",
    "material":"Stainless Steel"
  },
  {
    "id":41,
    "brand":"Titan",
    "imageUrl":"https://www.titan.co.in/product/titan-quartz-analog-watch-with-blue-colour-strap-for-women-95189kc02",
    "watchName":"Purple Ceramics Black",
    "gender":"Men",
    "watchColor":"Black",
    "description":"Ceramic case with Mineral Glass. Round case shape. Case size: 38 mm, Case thickness: 4.5 mm,Water resistant at 5 ATM.",
    "price":125,
    "techType":"Analog",
    "type":"Watch",
    "material":"Ceramic"
  },
  {
    "id":42,
    "brand":"Titan",
    "imageUrl":"https://www.titan.co.in/product/titan-quartz-analog-watch-with-white-colour-strap-for-women-95189kc01",
    "watchName":"Purple Ceramics white",
    "gender":"Unisex",
    "watchColor":"White",
    "description":"Ceramic case with Mineral Glass. Round case shape. Case size: 38 mm, Case thickness: 4.5 mm,Water resistant at 5 ATM.",
    "price":125,
    "techType":"Analog",
    "type":"Watch",
    "material":"Ceramic"
  },
  {
    "id":43,
    "brand":"Titan",
    "imageUrl":"https://www.titan.co.in/product/titan-quartz-analog-watch-with-purple-colour-strap-for-women-95189kc06",
    "watchName":"Purple Ceramics Purple",
    "gender":"Ladies",
    "watchColor":"Purple",
    "description":"Ceramic case with Mineral Glass. Round case shape. Case size: 38 mm, Case thickness: 4.5 mm,Water resistant at 5 ATM.",
    "price":125,
    "techType":"Analog",
    "type":"Watch",
    "material":"Ceramic"
  },
  {
    "id":44,
    "brand":"Eterno",
    "imageUrl":"https://eternowatch.com/san-pham/dong-ho-nam-eterno-em2002l-trang",
    "watchName":"Eterno EM2002L Black",
    "gender":"Men",
    "watchColor":"Black",
    "description":"Exquisite design shows the strong and elegant style of men. 316L Stainless Steel case Sapphire Glass and leather  strap, Round case shape. Case size: 40 mm, Case thickness: 10 mm. Dial markers: Index. Water resistant at 3 ATM. Lifetime battery warranty.",
    "price":96,
    "techType":"Analog",
    "type":"Watch",
    "material":"Leather"
  },
  {
    "id":45,
    "brand":"Eterno",
    "imageUrl":"https://eternowatch.com/san-pham/dong-ho-nam-eterno-em2002l-trang-2",
    "watchName":"Eterno EM2002L Brown",
    "gender":"Men",
    "watchColor":"Brown",
    "description":"Exquisite design shows the strong and elegant style of men. 316L Stainless Steel case Sapphire Glass and leather  strap, Round case shape. Case size: 40 mm, Case thickness: 10 mm. Dial markers: Index. Water resistant at 3 ATM. Lifetime battery warranty.",
    "price":96,
    "techType":"Analog",
    "type":"Watch",
    "material":"Leather"
  },
  {
    "id":46,
    "brand":"Eterno",
    "imageUrl":"https://eternowatch.com/san-pham/dong-ho-nam-eterno-em2002l",
    "watchName":"Eterno EM2002L Siliver",
    "gender":"Men",
    "watchColor":"Siliver",
    "description":"Exquisite design shows the strong and elegant style of men. 316L Stainless Steel case Sapphire Glass and metal  strap, Round case shape. Case size: 40 mm, Case thickness: 10 mm. Dial markers: Index. Water resistant at 3 ATM. Lifetime battery warranty.",
    "price":96,
    "techType":"Analog",
    "type":"Watch",
    "material":"316L Stainless Steel"
  },
  {
    "id":47,
    "brand":"Eterno",
    "imageUrl":"https://eternowatch.com/san-pham/dong-ho-nam-eterno-em2002l-vang",
    "watchName":"Eterno EM2002L Gold",
    "gender":"Men",
    "watchColor":"Yellow Gold-plated",
    "description":"Exquisite design shows the strong and elegant style of men. 316L Stainless Steel case Sapphire Glass and metal  strap, Round case shape. Case size: 40 mm, Case thickness: 10 mm. Dial markers: Index. Water resistant at 3 ATM. Lifetime battery warranty.",
    "price":96,
    "techType":"Analog",
    "type":"Watch",
    "material":"316L Stainless Steel"
  },
  {
    "id":48,
    "brand":"Eterno",
    "imageUrl":"https://eternowatch.com/san-pham/dong-ho-nam-eterno-em2002l-demi",
    "watchName":"Eterno EM2002L Demi",
    "gender":"Men",
    "watchColor":"Siliver",
    "description":"Exquisite design shows the strong and elegant style of men. 316L Stainless Steel case Sapphire Glass and metal  strap, Round case shape. Case size: 40 mm, Case thickness: 10 mm. Dial markers: Index. Water resistant at 3 ATM. Lifetime battery warranty.",
    "price":96,
    "techType":"Analog",
    "type":"Watch",
    "material":"316L Stainless Steel"
  },
  {
    "id":49,
    "brand":"Eterno",
    "imageUrl":"https://eternowatch.com/san-pham/eterno-em1902l-demi",
    "watchName":"Eterno EM1902L Demi",
    "gender":"Men",
    "watchColor":"Siliver",
    "description":"Exquisite design shows the strong and elegant style of men. 316L Stainless Steel case Sapphire Glass and metal  strap, Round case shape. Case size: 41 mm, Case thickness: 10 mm, case width: 195mm. Dial markers: Roman Numeral. Water resistant at 3 ATM. Lifetime battery warranty.",
    "price":60,
    "techType":"Analog",
    "type":"Watch",
    "material":"316L Stainless Steel"
  },
  {
    "id":50,
    "brand":"Eterno",
    "imageUrl":"https://eternowatch.com/san-pham/dong-ho-nam-eterno-em1902l-da-4",
    "watchName":"Eterno EM1902L Gold and Brown",
    "gender":"Men",
    "watchColor":"Brown",
    "description":"Exquisite design shows the strong and elegant style of men. 316L Stainless Steel case Sapphire Glass and leather  strap, Round case shape. Case size: 41 mm, Case thickness: 10 mm, case width: 195mm. Dial markers: Roman Numeral. Water resistant at 3 ATM. Lifetime battery warranty.",
    "price":60,
    "techType":"Analog",
    "type":"Watch",
    "material":"Leather"
  },
  {
    "id":51,
    "brand":"Eterno",
    "imageUrl":"https://eternowatch.com/san-pham/dong-ho-nam-eterno-em1902l-full-vang",
    "watchName":"Eterno EM1902L  Gold",
    "gender":"Men",
    "watchColor":"Yellow Gold-plated",
    "description":"Exquisite design shows the strong and elegant style of men. 316L Stainless Steel case Sapphire Glass and leather  strap, Round case shape. Case size: 41 mm, Case thickness: 10 mm, case width: 195mm. Dial markers: Roman Numeral. Water resistant at 3 ATM. Lifetime battery warranty.",
    "price":60,
    "techType":"Analog",
    "type":"Watch",
    "material":"316L Stainless Steel"
  },
  {
    "id":52,
    "brand":"Eterno",
    "imageUrl":"https://eternowatch.com/san-pham/dong-ho-nam-eterno-em1902l-da",
    "watchName":"Eterno EM1902L Gold and Black",
    "gender":"Men",
    "watchColor":"Black",
    "description":"Exquisite design shows the strong and elegant style of men. 316L Stainless Steel case Sapphire Glass and leather  strap, Round case shape. Case size: 41 mm, Case thickness: 10 mm, case width: 195mm. Dial markers: Roman Numeral. Water resistant at 3 ATM. Lifetime battery warranty.",
    "price":60,
    "techType":"Analog",
    "type":"Watch",
    "material":"Leather"
  },
  {
    "id":53,
    "brand":"Eterno",
    "imageUrl":"https://eternowatch.com/san-pham/dong-ho-nam-eterno-em1902l",
    "watchName":"Eterno EM1902L Demi Black",
    "gender":"Men",
    "watchColor":"Black",
    "description":"Exquisite design shows the strong and elegant style of men. 316L Stainless Steel case Sapphire Glass and leather  strap, Round case shape. Case size: 41 mm, Case thickness: 10 mm, case width: 195mm. Dial markers: Roman Numeral. Water resistant at 3 ATM. Lifetime battery warranty.",
    "price":60,
    "techType":"Analog",
    "type":"Watch",
    "material":"Leather"
  },
  {
    "id":54,
    "brand":"Tissot",
    "imageUrl":"https://www.jomashop.com/tissot-seastar-1000-watch-t1204071704100.html",
    "watchName":"Seastar 1000 Automatic Blue Dial Men's Watch T1204071704100",
    "gender":"Men",
    "watchColor":"Blue",
    "description":"Stainless steel case with a black rubber strap. Uni-directional rotating stainless steel bezel with a black ceramic ring. Blue dial with luminous silver-tone hands and dot hour markers. Minute markers around the outer rim. Dial Type: Analog. Luminescent hands and markers. Date display above the 6 o'clock position. Powermatic 80.111 automatic movement, containing 23 Jewels, bitting at 28800 vph, and has a power reserve of approximately 80 hours. Scratch resistant sapphire crystal. Screw down crown. Transparent case back. Round case shape. Case size: 43 mm. Case thickness: 12.7 mm. Band width: 21 mm. Tang clasp. Water resistant at 300 meters / 1000 feet. Functions: date, hour, minute, second. Seastar 1000 Series. Dive watch style. Watch label: Swiss Made. Tissot Seastar 1000 Automatic Blue Dial Men's Watch T1204071704100.",
    "price":470,
    "techType":"Analog",
    "type":"Watch",
    "material":"Stainless Steel"
  },
  {
    "id":55,
    "brand":"Tissot",
    "imageUrl":"https://www.jomashop.com/tissot-watch-t035-207-22-031-00.html",
    "watchName":"Couturier Powermatic 80 Ladies Watch",
    "gender":"Ladies",
    "watchColor":"Siliver",
    "description":"Stainless steel case with a two-tone (silver-tone and yellow gold PVD) stainless steel bracelet. Fixed yellow gold PVD bezel. Silver dial with yellow gold-tone dauphine-style hands and index hour markers. Minute markers around the outer rim. Dial Type: Analog. Luminescent hands and markers. Date display at the 3 o'clock position. Tissot calibre Powermatic 80 (C07.111) automatic movement, based upon ETA 2824-2, containing 23 Jewels, bitting at 21600 vph, and has a power reserve of approximately 80 hours. Scratch resistant sapphire crystal. Transparent case back. Round case shape. Case size: 32 mm. Case thickness: 10 mm. Band width: 18 mm. Butterfly clasp. Water resistant at 100 meters / 330 feet. Functions: date, hour, minute, second. Luxury watch style. Watch label: Swiss Made. Tissot Couturier Powermatic 80 Ladies Watch T035.207.22.031.00.",
    "price":239,
    "techType":"Analog",
    "type":"Watch",
    "material":"Stainless Steel"
  },
  {
    "id":56,
    "brand":"Tissot",
    "imageUrl":"https://www.jomashop.com/tissot-watch-t1184103605700.html",
    "watchName":"Heritage Visodate Black Dial Brown Leather Men's Watch T1184103605700",
    "gender":"Men",
    "watchColor":"Brown",
    "description":"Antique bronze PVD stainless steel case with a brown (embossed cow) leather strap. Fixed antique bronze PVD bezel. Black dial with gold-tone hands and index hour markers. Arabic numerals mark the 3, 6, 9 and 12 o'clock positions. Minute markers around the outer rim. Dial Type: Analog. Date display at the 3 o'clock position. ETA caliber F06.111 quartz movement. Scratch resistant sapphire crystal. Pull / push crown. Solid case back. Round case shape. Case size: 40 mm. Case thickness: 10.7 mm. Band width: 20 mm. Tang clasp. Water resistant at 30 meters / 100 feet. Functions: date, hour, minute, second. Casual watch style. Watch label: Swiss Made. Tissot Heritage Visodate Black Dial Brown Leather Men's Watch T1184103605700.",
    "price":138,
    "techType":"Analog",
    "type":"Watch",
    "material":"Stainless Steel"
  },
  {
    "id":57,
    "brand":"Tissot",
    "imageUrl":"https://www.jomashop.com/tissot-t-race-mens-watch-t0814201701700.html",
    "watchName":"T-Race Analog Digital White Rubber Unisex Watch T0814201701700",
    "gender":"Unisex",
    "watchColor":"White",
    "description":"Stainless steel case with a white rubber strap. Fixed stainless steel bezel. White dial with luminous black hands and index hour markers. Arabic numerals mark the 3, 9 and 12 o'clock positions. Dial Type: Analog-Digital. Luminescent hands. Perpetual calendar. Digital multi-function sub-dial. ETA caliber E49.301 quartz movement. Scratch resistant sapphire crystal. Screw down crown. Solid case back. Round case shape. Case size: 42 mm. Case thickness: 13.45 mm. Band width: 20 mm. Tang clasp. Water resistant at 100 meters / 330 feet. Functions: perpetual calendar, chronograph, world time, alarm, month, date, day, GMT, second time zone, hour, minute, second, thermometer, barometer, compass, tide indicator. Additional Info: touch screen, stop watch, split time. T-race Series. Sport watch style. Watch label: Swiss Made. Tissot T-Race Analog Digital White Rubber Unisex Watch T0814201701700.",
    "price":169,
    "techType":"Analog-digital",
    "type":"Watch",
    "material":"Stainless Steel"
  },
  {
    "id":58,
    "brand":"Tissot",
    "imageUrl":"https://www.jomashop.com/tissot-watch-t0954103711700.html",
    "watchName":"Quickster Mother of Pearl Dial Striped Nylon 40mm Watch T0954103711700",
    "gender":"Unisex",
    "watchColor":"White",
    "description":"Rose gold-tone stainless steel case with a striped nylon strap. Fixed rose gold-tone bezel. Mother of pearl dial with luminous gold-toned hands and index hour markers. An Arabic numeral appears at the 12 o'clock position. Minute markers around the outer rim. Dial Type: Analog. Luminescent hands. Date display at the 6 o'clock position. Quartz movement. Scratch resistant sapphire crystal. Solid case back. Case diameter: 40 mm. Case thickness: 9.12 mm. Round case shape. Strap width: 19 mm. Tang clasp. Water resistant at 100 meters / 330 feet. Functions: date, hour, minute, second. Casual watch style. Watch label: Swiss Made. Tissot Quickster Mother of Pearl Dial Striped Nylon Strap 40mm Watch T0954103711700..",
    "price":124,
    "techType":"Analog",
    "type":"Watch",
    "material":"Nylon"
  },
  {
    "id":59,
    "brand":"Tissot",
    "imageUrl":"https://www.jomashop.com/tissot-prx-chronograph-automatic-blue-dial-mens-watch-t1374271104100.html",
    "watchName":"PRX Chronograph Automatic Blue Dial Men's Watch",
    "gender":"Men",
    "watchColor":"Siliver",
    "description":"Silver-tone stainless steel case and bracelet. Fixed silver-tone stainless steel bezel. Blue dial with silver-tone hands and index hour markers. Minute markers around the outer rim. Dial Type: Analog. Luminescent hands and markers. Date display between 4 and 5 o'clock position. Chronograph - three sub-dials displaying: 60 second, 30 minute and 12 hour. Caliber Valjoux A05.H31 automatic movement. Scratch resistant sapphire crystal. Transparent case back. Tonneau case shape, case size: 42 mm, case thickness: 14.5 mm. Band width: 13 mm. Butterfly clasp. Water resistant at 100 meters / 330 feet. Functions: chronograph, date, hour, minute, second. Prx Series. Casual watch style. Watch label: Swiss Made. Tissot PRX Chronograph Automatic Blue Dial Men's Watch T1374271104100.",
    "price":1450,
    "techType":"Analog",
    "type":"Watch",
    "material":"Stainless Steel"
  },
  {
    "id":60,
    "brand":"Tissot",
    "imageUrl":"https://www.jomashop.com/tissot-heritage-porto-hand-wind-silver-dial-ladies-watch-t128-505-16-012-00.html",
    "watchName":"Heritage Porto Hand Wind Silver Dial Ladies Watch",
    "gender":"Ladies",
    "watchColor":"Black",
    "description":"316L stainless steel case with a black (croco-embossed) leather strap. Fixed stainless steel bezel. Silver dial with black spade-shaped hands and Arabic numeral hour markers. Minute markers around an inner ring. Dial Type: Analog. Small seconds sub-dial. ETA caliber 7001 hand wind movement with a 46-hour power reserve. Scratch resistant sapphire crystal. Pull / push crown. Solid case back. Tonneau case shape. Case size: 31.1 mm. Case thickness: 10.47 mm. Band width: 16 mm. Butterfly clasp. Water resistant at 30 meters / 100 feet. Functions: hour, minute, small second. Casual watch style. Watch label: Swiss Made. Tissot Heritage Porto Hand Wind Silver Dial Ladies Watch T128.505.16.012.00.",
    "price":376,
    "techType":"Analog",
    "type":"Watch",
    "material":"316L stainless steel"
  },
  {
    "id":61,
    "brand":"Tissot",
    "imageUrl":"https://www.jomashop.com/tissot-t-race-watch-t1154172705100.html",
    "watchName":"T-Race Chronograph Quartz Black Dial Men's Watch T1154172705100",
    "gender":"Men",
    "watchColor":"Red",
    "description":"Stainless steel case with a red rubber strap. Fixed black PVD bezel. Black dial with luminous grey hands and index hour markers. Minute markers. Tachymeter markings around the outer rim. Dial Type: Analog. Luminescent hands and markers. Date display at the 3 o'clock position. Chronograph - three sub-dials displaying: 60 second, 30 minute and 1/10th of a second. ETA caliber G10.212 quartz movement. Scratch resistant sapphire crystal. Solid case back. Round case shape. Case size: 47.6 mm. Case thickness: 12.3 mm. Band width: 22 mm. Tang clasp. Water resistant at 100 meters / 330 feet. Functions: chronograph, rattrapante, date, hour, minute, small second. Casual watch style. Watch label: Swiss Made. Tissot T-Race Chronograph Quartz Black Dial Men's Watch T1154172705100.",
    "price":395,
    "techType":"Analog",
    "type":"Watch",
    "material":"Stainless Steel"
  },
  {
    "id":62,
    "brand":"Tissot",
    "imageUrl":"https://www.jomashop.com/tissot-seastar-chronograph-quartz-blue-dial-mens-watch-t120-417-11-041-03.html",
    "watchName":"Seastar Chronograph Quartz Blue Dial Pepsi Bezel ",
    "gender":"Men",
    "watchColor":"Siliver",
    "description":"Stainless steel case with a stainless steel bracelet. Uni-directional rotating stainless steel bezel with an inlaid red and blue ceramic ring. Blue dial with luminous grey hands and dot hour markers. Minute markers around the outer rim. Dial Type: Analog. Luminescent hands and markers. Date display between the 4 and 5 o'clock positions. Chronograph - three sub-dials displaying: 60 second, 30 minute and 1/10th of a second. ETA caliber G10.212 quartz movement. Scratch resistant sapphire crystal. Screw down crown. Solid case back. Round case shape. Case size: 45.5 mm. Case thickness: 12.8 mm. Deployment clasp. Water resistant at 300 meters / 1000 feet. Functions: chronograph, date, hour, minute, second. Seastar Series. Casual watch style. Watch label: Swiss Made. Tissot Seastar Chronograph Quartz Blue Dial Men's Watch T120.417.11.041.03.",
    "price":376,
    "techType":"Analog",
    "type":"Watch",
    "material":"Stainless Steel"
  },
  {
    "id":63,
    "brand":"Tissot",
    "imageUrl":"https://www.jomashop.com/tissot-watch-t116-617-36-051-09.html",
    "watchName":"NBA Teams Houston Rockets Quartz Black Dial Watch ",
    "gender":"Men",
    "watchColor":"Black",
    "description":"Black PVD stainless steel case with a black (embossed cow) leather strap. Fixed black PVD bezel. Black (Houston Rockets logo) dial with luminous hands and index hour markers. Minute markers around the outer rim. Dial Type: Analog. Luminescent hands and markers. Date display at the 4 o'clock position. Chronograph - three sub-dials displaying: 60 second, 30 minute and 12 hour. Caliber ETA G10.212 quartz movement. Scratch resistant sapphire crystal. Solid case back. Round case shape. Case size: 45 mm. Case thickness: 11 mm. Band width: 22 mm. Tang clasp. Water resistant at 100 meters / 330 feet. Nba Teams Houston Rockets Series. Casual watch style. Watch label: Swiss Made. Tissot NBA Teams Houston Rockets Quartz Black Dial Watch T116.617.36.051.09.",
    "price":199,
    "techType":"Analog",
    "type":"Watch",
    "material":"Stainless Steel"
  },
  {
    "id":64,
    "brand":"Tissot",
    "imageUrl":"https://www.jomashop.com/tissot-watch-t0580093303100.html",
    "watchName":"T-Trend Lovely Silver Dial Ladies Watch T0580093303100 ",
    "gender":"Ladies",
    "watchColor":"Yellow Gold-plated",
    "description":"Yellow gold-plated stainless steel case and bracelet. Fixed yellow gold-plated bezel. Silver dial with gold-tone hands and dot hour markers. Dial Type: Analog. Quartz movement. Scratch resistant sapphire crystal. Pull / push crown. Solid case back. Case diameter: 19.5 mm. Case thickness: 5 mm. Round case shape. Band width: 10 mm. Fold over clasp with a push button release. Water resistant at 30 meters / 100 feet. Functions: hour, minute. Dress watch style. Tissot T-Trend Lovely Silver Dial Gold-plated Ladies Watch T0580093303100.",
    "price":275,
    "techType":"Analog",
    "type":"Watch",
    "material":"Stainless Steel"
  },
  {
    "id":65,
    "brand":"Tissot",
    "imageUrl":"https://www.jomashop.com/tissot-watch-t058-109-11-041-00.html",
    "watchName":"Lovely Square Quartz Blue Dial Ladies Watch ",
    "gender":"Ladies",
    "watchColor":"Siliver",
    "description":"Stainless steel case with a stainless steel mesh bracelet. Fixed stainless steel bezel. Blue dial with silver-tone hands and index hour markers. Dial Type: Analog. ETA caliber 901.001 quartz movement. Scratch resistant sapphire crystal. Pull / push crown. Solid case back. Cushion case shape. Case size: 20 mm. Case thickness: 7.1 mm. Band width: 9 mm. Jewelry clasp. Water resistant at 30 meters / 100 feet. Functions: hour, minute. Casual watch style. Watch label: Swiss Made. Tissot Lovely Square Quartz Blue Dial Ladies Watch T058.109.11.041.00.",
    "price":220,
    "techType":"Analog",
    "type":"Watch",
    "material":"Stainless Steel"
  },
  {
    "id":66,
    "brand":"DivineCrafts",
    "imageUrl":"https://www.flipkart.com/divinecrafts-analog-32-5-cm-x-wall-clock/p/itmf2y27hrggsxkk?pid=WCKF2YYBRA2ZUWMG&lid=LSTWCKF2YYBRA2ZUWMGWYG43C&marketplace=FLIPKART&q=CLOCK&store=arb%2Fkjw&spotlightTagId=BestsellerId_arb%2Fkjw&srno=s_1_2&otracker=search&otracker1=search&fm=Search&iid=5ae77675-843c-4d8e-8a9b-7ab18b3f1b76.WCKF2YYBRA2ZUWMG.SEARCH&ppt=sp&ppn=sp&ssid=d1mbxllirk0000001685177916101&qH=ca6c44800b2dc123",
    "watchName":"Handpainted Peacock Wall Clock ",
    "gender":"",
    "watchColor":"Multicolor",
    "description":"Size: 32.5 cm x 32.5 cm, Mechanism: Quartz, Frame Material: Wooden, Power Source: Battery, Clock Type: Analog, Hour Markers: English Numerals, Character :Peacock.",
    "price":15,
    "techType":"Analog",
    "type":"Clock",
    "material":"Wooden"
  },
  {
    "id":67,
    "brand":"Matiz",
    "imageUrl":"https://www.flipkart.com/matiz-analog-20-cm-x-wall-clock/p/itm1eb1210ba73bd?pid=WCKGMXHWGYWVBZK7&lid=LSTWCKGMXHWGYWVBZK7IGK8OF&marketplace=FLIPKART&store=arb%2Fkjw%2Fbm1&srno=b_1_3&otracker=browse&fm=organic&iid=c532d932-17bd-43c3-bbfa-bf6afefec185.WCKGMXHWGYWVBZK7.SEARCH&ppt=browse&ppn=browse",
    "watchName":"Classic Matiz Wall Clock ",
    "gender":"",
    "watchColor":"White",
    "description":"Size: 32.5 cm x 32.5 cm, Mechanism: Quartz, Frame Material: Wooden, Power Source: Battery, Clock Type: Analog, Hour Markers: English Numerals, Character :Peacock.",
    "price":13,
    "techType":"Analog",
    "type":"Clock",
    "material":"Plastic"
  },
  {
    "id":68,
    "brand":"Matiz",
    "imageUrl":"https://www.flipkart.com/big-bang-creations-analog-33-cm-x-24-wall-clock/p/itmbb50b67bf9511?pid=WCKFQY3J33XRQFZV&lid=LSTWCKFQY3J33XRQFZVXTX6XV&marketplace=FLIPKART&store=arb%2Fkjw%2Fbm1&srno=b_1_6&otracker=browse&fm=organic&iid=c532d932-17bd-43c3-bbfa-bf6afefec185.WCKFQY3J33XRQFZV.SEARCH&ppt=browse&ppn=browse",
    "watchName":"Lord Ganesha Shape Vintage Wall Clock",
    "gender":"",
    "watchColor":"White",
    "description":"This Wall Clock is a Unique design to decorate your wall offer a superlative way to place time on the wall. Size: 24 cm x 33 cm, Mechanism: Quartz, Frame Material: Plastic. Character: Lord Ganesha, Power Source: Battery Powered. ",
    "price":17,
    "techType":"Analog",
    "type":"Clock",
    "material":"Plastic"
  },
  {
    "id":69,
    "brand":"Titan",
    "imageUrl":"https://www.flipkart.com/titan-analog-30-cm-x-wall-clock/p/itmc72b8b4ae8444?pid=WCKFGGFHGTV8UEK5&lid=LSTWCKFGGFHGTV8UEK5YSQRQF&marketplace=FLIPKART&store=arb%2Fkjw%2Fbm1&srno=b_1_14&otracker=browse&fm=organic&iid=c532d932-17bd-43c3-bbfa-bf6afefec185.WCKFGGFHGTV8UEK5.SEARCH&ppt=browse&ppn=browse",
    "watchName":"Titan Analog Wall Clock NAW0036PA01",
    "gender":"",
    "watchColor":"White",
    "description":"The slim hand profiles and slender markings on the dial give a minimalistic look to this clock. Size: 30 cm x 30 cm. Mechanism: Silent Sweep. Frame Material: Plastic. Power Source: Battery. ",
    "price":20,
    "techType":"Analog",
    "type":"Clock",
    "material":"Plastic"
  },
  {
    "id":70,
    "brand":"Titan",
    "imageUrl":"https://www.flipkart.com/titan-analog-30-5-cm-x-wall-clock/p/itmcc897b74178f3?pid=WCKFGHVRMJGHBHTP&lid=LSTWCKFGHVRMJGHBHTPKVMAA7&marketplace=FLIPKART&store=arb%2Fkjw%2Fbm1&srno=b_1_35&otracker=browse&fm=organic&iid=c532d932-17bd-43c3-bbfa-bf6afefec185.WCKFGHVRMJGHBHTP.SEARCH&ppt=browse&ppn=browse",
    "watchName":"Titan Analog Wall Clock NBW0002PA01",
    "gender":"",
    "watchColor":"White",
    "description":"Its indices are stylish and embossed to enhance the decor of your home. Size: 30.5 cm x 30.5 cm. Mechanism: Silent Sweep. Frame Material: Plastic. ",
    "price":21,
    "techType":"Analog",
    "type":"Clock",
    "material":"Plastic"
  },
  {
    "id":71,
    "brand":"Titan",
    "imageUrl":"https://www.flipkart.com/titan-analog-29-5-cm-x-wall-clock/p/itma78054d39910f?pid=WCKFPBCZG52KS6Y5&lid=LSTWCKFPBCZG52KS6Y5POBH7B&marketplace=FLIPKART&store=arb%2Fkjw%2Fbm1&srno=b_3_83&otracker=browse&fm=organic&iid=f9620bcf-b1c5-4a3f-abf1-f3d6d84396b6.WCKFPBCZG52KS6Y5.SEARCH&ppt=browse&ppn=browse",
    "watchName":"Titan Analog Wall clock NBW0043PA01A",
    "gender":"",
    "watchColor":"Grey",
    "description":"Size: 29.5 cm x 29.5 cm. Mechanism: Quartz. Frame Material: Plastic, Hour Markers: English Numerals. Weight: 600 g. Other Features: Silent Sweep. ",
    "price":18,
    "techType":"Analog",
    "type":"Clock",
    "material":"Plastic"
  },
  {
    "id":72,
    "brand":"Kadio",
    "imageUrl":"https://www.flipkart.com/kadio-analog-25-cm-x-wall-clock/p/itm3a88387d97ede?pid=WCKGKPJAFQGCXXYP&lid=LSTWCKGKPJAFQGCXXYPNNPCE2&marketplace=FLIPKART&store=arb%2Fkjw%2Fbm1&srno=b_3_86&otracker=browse&fm=organic&iid=f9620bcf-b1c5-4a3f-abf1-f3d6d84396b6.WCKGKPJAFQGCXXYP.SEARCH&ppt=browse&ppn=browse",
    "watchName":"Kadio Square wall clock",
    "gender":"",
    "watchColor":"White",
    "description":"This beautiful wall clock by Kadio is made up with Plastic which gives your home a vintage look. Size: 25 cm x 25 cm. Frame Material: Plastic. ",
    "price":10,
    "techType":"Analog",
    "type":"Clock",
    "material":"Plastic"
  },
  {
    "id":73,
    "brand":"Kadio",
    "imageUrl":"https://www.flipkart.com/kadio-analog-24-5-cm-x-wall-clock/p/itm43e1418bdceea?pid=WCKGE2G8G8QD4NAN&lid=LSTWCKGE2G8G8QD4NAN1CLOLJ&marketplace=FLIPKART&store=arb%2Fkjw%2Fbm1&srno=b_3_88&otracker=browse&fm=organic&iid=f9620bcf-b1c5-4a3f-abf1-f3d6d84396b6.WCKGE2G8G8QD4NAN.SEARCH&ppt=browse&ppn=browse",
    "watchName":"Kadio Handcrafted Wall Clock",
    "gender":"",
    "watchColor":"White",
    "description":"This beautiful wall clock by Kadio is made up with Plastic which gives your home a vintage look. Size: 25 cm x 25 cm. Frame Material: Plastic. ",
    "price":19,
    "techType":"Analog",
    "type":"Clock",
    "material":"Plastic"
  },
  {
    "id":74,
    "brand":"Kadio",
    "imageUrl":"https://www.flipkart.com/kadio-analog-22-cm-x-wall-clock/p/itm5a464ffb1c145?pid=WCKGMFFCTXFGRM58&lid=LSTWCKGMFFCTXFGRM58UEM1BG&marketplace=FLIPKART&store=arb%2Fkjw%2Fbm1&srno=b_3_94&otracker=browse&fm=organic&iid=f9620bcf-b1c5-4a3f-abf1-f3d6d84396b6.WCKGMFFCTXFGRM58.SEARCH&ppt=browse&ppn=browse",
    "watchName":"Kadio Round Wall Clock Pink",
    "gender":"",
    "watchColor":"White",
    "description":"Size: 22 cm x 22 cm. Frame Material: Plastic. Power Source: AA battery. ",
    "price":11,
    "techType":"Analog",
    "type":"Clock",
    "material":"Plastic"
  },
  {
    "id":75,
    "brand":"Kadio",
    "imageUrl":"https://www.flipkart.com/kadio-analog-32-cm-x-wall-clock/p/itm45522a3c5d611?pid=WCKGGTYDBCF4ZC3B&lid=LSTWCKGGTYDBCF4ZC3B114WLA&marketplace=FLIPKART&sattr[]=color&st=color&otracker=browse",
    "watchName":"Kadio Night Glow Clock",
    "gender":"",
    "watchColor":"Black",
    "description":"The clock has a night glow concept as the hands of the clock have a radium touch. Size: 32 cm x 32 cm. Frame Material: Plastic. ",
    "price":14,
    "techType":"Analog",
    "type":"Clock",
    "material":"Plastic"
  },
  {
    "id":76,
    "brand":"Kadio",
    "imageUrl":"https://www.flipkart.com/kadio-analog-24-5-cm-x-wall-clock/p/itm3d4f6f3ad62b1?pid=WCKGFCKEFRDUSC7W&lid=LSTWCKGFCKEFRDUSC7WTZLDJ4&marketplace=FLIPKART&store=arb%2Fkjw%2Fbm1&srno=b_2_57&otracker=browse&fm=organic&iid=49be5c36-28b7-4eac-abc7-3d210dd051d2.WCKGFCKEFRDUSC7W.SEARCH&ppt=browse&ppn=browse",
    "watchName":"Kadio Round Clock",
    "gender":"",
    "watchColor":"Black",
    "description":"The catchy numeric and hands display in an array of colours is what gives a distinguishing look to the clock. Size: 24.5 cm x 24.5 cm. Frame Material: Plastic. ",
    "price":9,
    "techType":"Analog",
    "type":"Clock",
    "material":"Plastic"
  },
  {
    "id":77,
    "brand":"Ajanta",
    "imageUrl":"https://www.flipkart.com/ajanta-digital-25-4-cm-x-wall-clock/p/itm181239ea78e10?pid=WCKGFWWNXQRU8NMG&lid=LSTWCKGFWWNXQRU8NMGHL787P&marketplace=FLIPKART&q=digital+wall+clock&store=arb%2Fkjw%2Fbm1&spotlightTagId=TrendingId_arb%2Fkjw%2Fbm1&srno=s_1_1&otracker=AS_QueryStore_OrganicAutoSuggest_1_8_na_na_ps&otracker1=AS_QueryStore_OrganicAutoSuggest_1_8_na_na_ps&fm=search-autosuggest&iid=4803d65c-4745-484b-a141-6ee91089a130.WCKGFWWNXQRU8NMG.SEARCH&ppt=sp&ppn=sp&ssid=9ld85y51og0000001685183477617&qH=e0ed8adf06f3fb90",
    "watchName":"Ajanta Digital Clock 302 green",
    "gender":"",
    "watchColor":"Black",
    "description":"The catchy numeric and hands display in an array of colours is what gives a distinguishing look to the clock. Size: 24.5 cm x 24.5 cm. Frame Material: Plastic. ",
    "price":25,
    "techType":"Digital",
    "type":"Clock",
    "material":"Plastic"
  },
  {
    "id":78,
    "brand":"Ajanta",
    "imageUrl":"https://www.flipkart.com/ajanta-digital-wall-clock/p/itme5yftedffffg7?pid=WCKDH6MJKAMU8YMW&lid=LSTWCKDH6MJKAMU8YMWZ3WQEI&marketplace=FLIPKART&q=digital+wall+clock&store=arb%2Fkjw%2Fbm1&srno=s_1_2&otracker=AS_QueryStore_OrganicAutoSuggest_1_8_na_na_ps&otracker1=AS_QueryStore_OrganicAutoSuggest_1_8_na_na_ps&fm=search-autosuggest&iid=4803d65c-4745-484b-a141-6ee91089a130.WCKDH6MJKAMU8YMW.SEARCH&ppt=sp&ppn=sp&ssid=9ld85y51og0000001685183477617&qH=e0ed8adf06f3fb90",
    "watchName":"Ajanta Digital Wall Clock OLC-105 red",
    "gender":"",
    "watchColor":"Black",
    "description":"Size: 25.4 cm x 25.4 cm, Frame Material: Plastic. Battery: 2 aa Batteries. Dial Material: Glass. ",
    "price":21,
    "techType":"Digital",
    "type":"Clock",
    "material":"Plastic"
  },
  {
    "id":79,
    "brand":"Ajanta",
    "imageUrl":"https://www.flipkart.com/ajanta-digital-20-cm-x-16-wall-clock/p/itma7915ffefd82e?pid=WCKGF5J5UYE7BANN&lid=LSTWCKGF5J5UYE7BANN8JW4EZ&marketplace=FLIPKART&q=digital+wall+clock&store=arb%2Fkjw%2Fbm1&srno=s_1_4&otracker=AS_QueryStore_OrganicAutoSuggest_1_8_na_na_ps&otracker1=AS_QueryStore_OrganicAutoSuggest_1_8_na_na_ps&fm=search-autosuggest&iid=4803d65c-4745-484b-a141-6ee91089a130.WCKGF5J5UYE7BANN.SEARCH&ppt=sp&ppn=sp&qH=e0ed8adf06f3fb90",
    "watchName":"Ajanta Digital Wall Clock  LCD 140",
    "gender":"",
    "watchColor":"Brown",
    "description":"Jumbo Liquid Crystal Display Wooden Polystyrene Frame Wall mountable and built in stand for descktop display Alarm clock and snooze function Temperature format in Degree C/F select 12/24Hr Date (Date/ Month/ Day) Display LCD Clock (Hour/ minor / Second) Display Key tone sound Low battery Indication. Size: 16 cm x 20 cm. Frame Material: Plastic. ",
    "price":20,
    "techType":"Digital",
    "type":"Clock",
    "material":"Plastic"
  },
  {
    "id":80,
    "brand":"Rujave",
    "imageUrl":"https://www.flipkart.com/rujave-digital-25-cm-x-wall-clock/p/itmf219be92533ac?pid=WCKGKYYQCXDKUUZE&lid=LSTWCKGKYYQCXDKUUZEMM5RX9&marketplace=FLIPKART&q=digital+wall+clock&store=arb%2Fkjw%2Fbm1&srno=s_3_106&otracker=AS_QueryStore_OrganicAutoSuggest_1_8_na_na_ps&otracker1=AS_QueryStore_OrganicAutoSuggest_1_8_na_na_ps&fm=search-autosuggest&iid=83891a90-4e9d-45f9-b7fd-e2faa5e6094e.WCKGKYYQCXDKUUZE.SEARCH&ppt=sp&ppn=sp&qH=e0ed8adf06f3fb90",
    "watchName":"Rujave Digital 25 cm X 25 cm Wall Clock",
    "gender":"",
    "watchColor":"Green",
    "description":"Acrylic Resin Type Printed Classic Stylish Wall Clock. Size: 25 cm x 25 cm. Frame Material: Metal ",
    "price":22,
    "techType":"Digital",
    "type":"Clock",
    "material":"Metal"
  },
  {
    "id":81,
    "brand":"Rujave",
    "imageUrl":"https://www.flipkart.com/rujave-digital-25-cm-x-wall-clock/p/itmefe5b57de3940?pid=WCKGKYYQYA3PBB6H&lid=LSTWCKGKYYQYA3PBB6HQFQTKV&marketplace=FLIPKART&q=digital+wall+clock&store=arb%2Fkjw%2Fbm1&srno=s_3_116&otracker=AS_QueryStore_OrganicAutoSuggest_1_8_na_na_ps&otracker1=AS_QueryStore_OrganicAutoSuggest_1_8_na_na_ps&fm=search-autosuggest&iid=83891a90-4e9d-45f9-b7fd-e2faa5e6094e.WCKGKYYQYA3PBB6H.SEARCH&ppt=sp&ppn=sp&qH=e0ed8adf06f3fb90",
    "watchName":"Rujave Digital 25 cm X 25 cm Wall Clock Colorfull",
    "gender":"",
    "watchColor":"Multicolor",
    "description":"The Clocks Are Very Durable Made Up Of Acrylic, Runs On The Power Of Battery and get a stylish and modern look. Size: 25 cm x 25 cm. Frame Material: Metal ",
    "price":21,
    "techType":"Digital",
    "type":"Clock",
    "material":"Metal"
  },
  {
    "id":82,
    "brand":"Rujave",
    "imageUrl":"https://www.flipkart.com/rujave-digital-30-cm-x-22-wall-clock/p/itma769394f6928d?pid=WCKGKY62DSHA3JCS&lid=LSTWCKGKY62DSHA3JCSBK3JZP&marketplace=FLIPKART&q=digital+wall+clock&store=arb%2Fkjw%2Fbm1&srno=s_4_124&otracker=AS_QueryStore_OrganicAutoSuggest_1_8_na_na_ps&otracker1=AS_QueryStore_OrganicAutoSuggest_1_8_na_na_ps&fm=search-autosuggest&iid=82836d50-d9eb-43e3-8d04-bc61cb31c76e.WCKGKY62DSHA3JCS.SEARCH&ppt=sp&ppn=sp&qH=e0ed8adf06f3fb90",
    "watchName":"Rujave Digital 30 cm X 22 cm Wall Clock ",
    "gender":"",
    "watchColor":"Blue",
    "description":"Material :-Acrylic ,Size, 25 cm x 25 cm Medium Size for Wall Decoration, acrylic surface let your room get a stylish and modern look. Frame Material: Marble",
    "price":18,
    "techType":"Digital",
    "type":"Clock",
    "material":"Marble"
  },
  {
    "id":83,
    "brand":"Rujave",
    "imageUrl":"https://www.flipkart.com/rujave-digital-30-cm-x-22-wall-clock/p/itm42b2aa6683a6f?pid=WCKGKY62Z4XTC6KF&lid=LSTWCKGKY62Z4XTC6KFFUPVD5&marketplace=FLIPKART&sattr[]=color&st=color",
    "watchName":"Rujave Digital 30 cm X 22 cm Wall Clock Pink  ",
    "gender":"",
    "watchColor":"Pink",
    "description":"Material :-Acrylic ,Size, 25 cm x 25 cm Medium Size for Wall Decoration, acrylic surface let your room get a stylish and modern look. Frame Material: Marble",
    "price":18,
    "techType":"Digital",
    "type":"Clock",
    "material":"Marble"
  },
  {
    "id":84,
    "brand":"Rujave",
    "imageUrl":"https://www.flipkart.com/rujave-digital-30-cm-x-22-wall-clock/p/itmfbaa37c40e331?pid=WCKGKY628WN4CT7K&lid=LSTWCKGKY628WN4CT7KUZUXVU&marketplace=FLIPKART&sattr[]=color&st=color&otracker=AS_QueryStore_OrganicAutoSuggest_1_8_na_na_ps",
    "watchName":"Rujave Digital 30 cm X 22 cm Wall Clock Yellow",
    "gender":"",
    "watchColor":"Yellow",
    "description":"Material :-Acrylic ,Size, 25 cm x 25 cm Medium Size for Wall Decoration, acrylic surface let your room get a stylish and modern look. Frame Material: Marble",
    "price":22,
    "techType":"Digital",
    "type":"Clock",
    "material":"Marble"
  }

  ]
}
